{
  "schema_version": 1,
  "edition": "gemini-cli",
  "client_name": "Gemini CLI",
  "native_skills_path": ".gemini/skills",
  "guidance": "Workspace skills live in `.gemini/skills/` and require trust; personal skills live in `~/.gemini/skills`. Use `/skills list` and `/skills reload`. Request a skill by name or describe the task, then grant activation consent if prompted. Activation is agent-managed, not a shell command, and grants no tool permissions. The profile advises `auto` for routine roles and `gemini-3.1-pro-preview` for complex work; preview access depends on account rollout. Gemini's client-owned routing and fallback can continue, including silent utility fallback, and ORQIVRA cannot disable them. `gemini-3.8-flash` is API-documented only; CLI qualification remains unresolved. Workspace trust, CLI policy, and confirmations govern access. Do not bypass denials; stop and report unavailable actions."
}
